{
  "pass": "A",
  "sample_seed": "s1-1",
  "prompt_injection_detected": false,
  "findings": [
    {
      "finding_id": "FND-053",
      "category": "strength",
      "validity": "valid",
      "materiality": "low",
      "severity_assessed": null,
      "acknowledged_by_design": false,
      "cites_design_acknowledgement": false,
      "doc_locations": [
        {
          "cited": "p.13 §17 'refuses private, loopback, link-local and cloud-metadata addresses'",
          "check": "verified"
        },
        {
          "cited": "p.13 §17 'Each endpoint has a cap of 20 in-flight deliveries and its own circuit breaker'",
          "check": "verified"
        }
      ],
      "external_sources": [],
      "recommendation": null,
      "no_change": {
        "justification_correct": true,
        "reasoned": true
      },
      "triage": {
        "review_label": "none",
        "correct_label": "not_applicable"
      },
      "padding": false,
      "note": "Accurate affirmation anchored to p.13 §17. The design does pin the resolved address ('connects to the validated address for that delivery') and isolates each endpoint, which supports FR-12/NFR-9. The no-change rationale is short but correct. Low materiality: it is an affirmation and does not change the verdict."
    },
    {
      "finding_id": "FND-012",
      "category": "gap",
      "validity": "valid",
      "materiality": "medium",
      "severity_assessed": "medium",
      "acknowledged_by_design": false,
      "cites_design_acknowledgement": false,
      "doc_locations": [
        {
          "cited": "p.20 §27 'Tokenisation, envelope encryption, HSM, SAD handling and network tokens specified'",
          "check": "verified"
        },
        {
          "cited": "p.21 §27 'The transaction core is specified to implementation level...'",
          "check": "verified"
        }
      ],
      "external_sources": [],
      "recommendation": {
        "issue": true,
        "rationale": true,
        "evidence": true,
        "expected_benefit": true,
        "objective_link": true,
        "coherent": true,
        "specific_and_bounded": true,
        "justified": true,
        "reopens_confirmed_decision": false
      },
      "no_change": null,
      "triage": {
        "review_label": "refinement",
        "correct_label": "refinement"
      },
      "padding": false,
      "note": "A derived meta-finding: §27 does mark the Idempotency Layer and Card Vault 'Ready' despite the conflicts raised in FND-001/002/029/006/036. It is valid and well located. The rationale ('phases 2 and 3 are gated') is thin, and the Fraud Hook is already 'Mostly ready' on p.20. Rating it 'low' slightly understates a readiness verdict that gates build. Medium is fairer."
    },
    {
      "finding_id": "FND-014",
      "category": "strength",
      "validity": "valid",
      "materiality": "low",
      "severity_assessed": null,
      "acknowledged_by_design": false,
      "cites_design_acknowledgement": false,
      "doc_locations": [
        {
          "cited": "p.3 §3 'These ten principles govern every design decision...'",
          "check": "verified"
        },
        {
          "cited": "p.2 §2 'Each requirement carries an ID used again in Section 26...'",
          "check": "verified"
        }
      ],
      "external_sources": [],
      "recommendation": null,
      "no_change": {
        "justification_correct": true,
        "reasoned": true
      },
      "triage": {
        "review_label": "none",
        "correct_label": "not_applicable"
      },
      "padding": false,
      "note": "A correct and anchored strength about traceability and the precedence rule (p.3 §3). It is useful context for the intent yardstick but has low materiality. It is not padding, because it is specific to this document's structure."
    },
    {
      "finding_id": "FND-022",
      "category": "gap",
      "validity": "valid",
      "materiality": "medium",
      "severity_assessed": "medium",
      "acknowledged_by_design": false,
      "cites_design_acknowledgement": false,
      "doc_locations": [
        {
          "cited": "p.6 §7.1 'One or more refunds succeeded against a captured or succeeded payment.'",
          "check": "verified"
        },
        {
          "cited": "p.19 §26.1 FR-2 'Randomised event sequences ... never produce a transition outside Section 7.2'",
          "check": "verified"
        },
        {
          "cited": "p.2 §2.1 FR-2",
          "check": "verified"
        }
      ],
      "external_sources": [],
      "recommendation": {
        "issue": true,
        "rationale": true,
        "evidence": true,
        "expected_benefit": true,
        "objective_link": true,
        "coherent": true,
        "specific_and_bounded": true,
        "justified": true,
        "reopens_confirmed_decision": false
      },
      "no_change": null,
      "triage": {
        "review_label": "refinement",
        "correct_label": "refinement"
      },
      "padding": false,
      "note": "Correct against p.6 §7.2. There is no PARTIALLY_REFUNDED self-transition, no CAPTURED self-transition for repeated partial captures, and no path from a refund state to SETTLED, even though §16.2 settles matched payments. A failed wallet payment or 3DS challenge from REQUIRES_ACTION may arguably route via AUTHORISING, and a REVIEW hold could sit in AUTHORISED, so those sub-points are weaker. The point that the FR-2 test is negative-only is a good insight."
    },
    {
      "finding_id": "FND-005",
      "category": "risk",
      "validity": "valid",
      "materiality": "high",
      "severity_assessed": "high",
      "acknowledged_by_design": false,
      "cites_design_acknowledgement": false,
      "doc_locations": [
        {
          "cited": "p.17 §21.1 'fewer than 1% of card payments cascade'",
          "check": "verified"
        },
        {
          "cited": "p.9 §10.5 'retryable outcomes ... 3.8%'",
          "check": "verified"
        },
        {
          "cited": "p.3 §2.2 NFR-2",
          "check": "verified"
        }
      ],
      "external_sources": [],
      "recommendation": {
        "issue": true,
        "rationale": true,
        "evidence": true,
        "expected_benefit": true,
        "objective_link": true,
        "coherent": true,
        "specific_and_bounded": true,
        "justified": true,
        "reopens_confirmed_decision": false
      },
      "no_change": null,
      "triage": {
        "review_label": "mixed",
        "correct_label": "mixed",
        "owner_or_next_step_named": true
      },
      "padding": false,
      "note": "A material internal contradiction, established correctly from the design's own figures (3.8% retryable vs '<1% cascade'; a 2,500 ms timeout vs the 1,500 ms NFR-2). It also notes that the §26.2 test injects 3.8%. 'Every one of them triggers a cascade' slightly overstates: scheme limits or no remaining candidate can stop a cascade. The deadline-based budget refines the confirmed cascade policy rather than reversing it. The owner is named."
    },
    {
      "finding_id": "FND-046",
      "category": "gap",
      "validity": "valid",
      "materiality": "high",
      "severity_assessed": "high",
      "acknowledged_by_design": false,
      "cites_design_acknowledgement": false,
      "doc_locations": [
        {
          "cited": "p.14 §18.4 'A confirmation email is sent to the user who made the change'",
          "check": "verified"
        },
        {
          "cited": "p.14 §18.3 'enforced for the Owner role at first login'",
          "check": "verified"
        },
        {
          "cited": "p.14 §18.2 Finance role permissions",
          "check": "verified"
        }
      ],
      "external_sources": [],
      "recommendation": {
        "issue": true,
        "rationale": true,
        "evidence": true,
        "expected_benefit": true,
        "objective_link": true,
        "coherent": true,
        "specific_and_bounded": true,
        "justified": true,
        "reopens_confirmed_decision": true
      },
      "no_change": null,
      "triage": {
        "review_label": "refinement",
        "correct_label": "mixed",
        "owner_or_next_step_named": false
      },
      "padding": false,
      "note": "A valid account-takeover-to-payout-fraud path. The P9 conflict is real: Finance holds both money-moving (refund) and configuration (payout account) rights (p.4 §3, p.14 §18.2). The finding explicitly challenges the confirmed MFA decision (p.19 §24), using the design's own P8/P9 as evidence, which is acceptable. Because it reopens a confirmed decision, it needs a governance sign-off, so 'refinement' alone is an incomplete label. No owner is named. The remedy bundles several controls but each is concrete."
    },
    {
      "finding_id": "FND-001",
      "category": "risk",
      "validity": "valid",
      "materiality": "high",
      "severity_assessed": "critical",
      "acknowledged_by_design": false,
      "cites_design_acknowledgement": false,
      "doc_locations": [
        {
          "cited": "p.8 §9.2 'idem:resp:{idempotency_key} with a 24-hour TTL'",
          "check": "verified"
        },
        {
          "cited": "p.4 §3 P3 'Idempotency is scoped to (merchant, key)'",
          "check": "verified"
        },
        {
          "cited": "p.7 §9.1 'frequently use their own order or invoice identifiers, which is accepted.'",
          "check": "verified"
        }
      ],
      "external_sources": [],
      "recommendation": {
        "issue": true,
        "rationale": true,
        "evidence": true,
        "expected_benefit": true,
        "objective_link": true,
        "coherent": true,
        "specific_and_bounded": true,
        "justified": true,
        "reopens_confirmed_decision": false
      },
      "no_change": null,
      "triage": {
        "review_label": "mixed",
        "correct_label": "refinement",
        "owner_or_next_step_named": true